{
  "lexicon": 1,
  "id": "com.omni-index.comment",
  "description": "Comment left by the user",
  "defs": {
    "main": {
      "type": "record",
      "key": "tid",
      "record": {
        "type": "object",
        "properties": {
          "text": {
            "type": "string",
            "maxLength": 3000,
            "maxGraphemes": 1000,
            "description": "The text of the comment"
          },
          "entrySlug": {
            "type": "string",
            "description": "The slug of the entry the comment is left on"
          },
          "createdAt": {
            "type": "string",
            "format": "datetime"
          }
        },
        "required": ["text", "entrySlug", "createdAt"]
      }
    }
  }
}
